"RicNumero"|"RicProtocollo"|"RicData"|"RicDataConsegna"|"RicOrdineNumero"|"RicOrdineData"|"RicCodiceFornitore"|"RicRagSocFornitore"|"RicAnaArtCodice"|"RicAnaArtDescrizione"|"RicQuantitaOrdinata"|"RicQuantitaRicevuta"
"PO32854"|"3942217"|"20170825"|"20170825"|"PO32854"|"20170808"|"FO20170808_PO32854"|"Babycar"|"RB3A010374"|"BABYCAR-99852R-AUDI A3 ROSSA"|"0000000001"|"0000000001"
"PO32857"|"3941217"|"20170825"|"20170825"|"PO32857"|"20170810"|"FO20170810_PO32857"|"Babycar"|"RB3A020839"|"BABYCAR-305v-Moto Cross Verde"|"0000000001"|"0000000001"
"PO32869"|"3940217"|"20170825"|"20170825"|"PO32869"|"20170811"|"FO20170811_PO32869"|"Funkit World"|"RB3A019651"|"FUNKIT WORLD-SBU-03-Funkit World Secchiello da Spiaggia in Silicone Verde"|"0000000002"|"0000000002"
"PO32869"|"3940217"|"20170825"|"20170825"|"PO32869"|"20170811"|"FO20170811_PO32869"|"Funkit World"|"RB3A019652"|"FUNKIT WORLD-SBU-05-Funkit World Secchiello da Spiaggia in Silicone Rosa"|"0000000002"|"0000000002"
"PO32869"|"3940217"|"20170825"|"20170825"|"PO32869"|"20170811"|"FO20170811_PO32869"|"Funkit World"|"RB3A019660"|"FUNKIT WORLD-SBB-62-Funkit World Borsa da Spiaggia in Silicone Viola"|"0000000002"|"0000000002"
