"SpeNumeroOrdine"|"SpeNumeroProtocollo"|"SpeEtichettaCollo"|"SpeTrackingNumero"|"SpeDataImport"|"SpeRigaOrdine"|"SpeArtCodice"|"SpeArtDescrizione"|"SpeArtQta"|"SpeCostoContrassegno"
"#34588"|"32833317"|"00000000000000358729"|"201705005303687"|"20170727"|"1"|"RB3A012456"|"VULLI-200319-Anello Dentizione morbido"|"0000000001"|"0000043.16"
"#34588"|"32833317"|"00000000000000358729"|"201705005303687"|"20170727"|"2"|"RB3A012457"|"VULLI-616324-Sophie la giraffa"|"0000000001"|"0000043.16"
"#34582"|"32834317"|"00000000000000358489"|"201705005303512"|"20170727"|"1"|"RB3A020989"|"MINILAND-89072-Borsa isotermica con 2 Contenitori Ermetici Blu"|"0000000001"|"0000037.44"
"#34582"|"32834317"|"00000000000000358489"|"201705005303512"|"20170727"|"2"|"RB3A020992"|"MINILAND-89071-Borsa isotermica con 2 Contenitori Ermetici Graduati Blu"|"0000000001"|"0000037.44"
"#34580"|"32835317"|"00000000000000358419"|"201705005303509"|"20170727"|"1"|"RB3A014098"|"NIKE-454501-PICO 4 (TDV) NERA 5C-EU21"|"0000000001"|"0000033.80"
"#34579"|"32836317"|"00000000000000358789"|"201705005303774"|"20170727"|"1"|"RB3A009819"|"FCTRY-GLSTA23-Occhiali da Sole Baby Rosa 0-2 anni"|"0000000001"|"0000048.82"
"#34579"|"32836317"|"00000000000000358789"|"201705005303774"|"20170727"|"2"|"RB3A011636"|"BIG MOUTH-BMBTDO-Telo da mare XXL Ciambella alla Fragola"|"0000000001"|"0000048.82"
"#34578"|"32837317"|"00000000000000358439"|"201705005303575"|"20170727"|"1"|"RB3A009884"|"A LITTLE LOVELY COMPANY-LTBX001-Box Lampada A5 per scritte"|"0000000001"|"0000030.76"
"#34575"|"32838317"|"00000000000000358779"|"201705005303827"|"20170727"|"1"|"RB3A009901"|"A LITTLE LOVELY COMPANY-LTCW025-Lampada Mini Nuvoletta Bianca"|"0000000001"|"0000100.92"
"#34575"|"32838317"|"00000000000000358779"|"201705005303827"|"20170727"|"2"|"RB3A009902"|"A LITTLE LOVELY COMPANY-LTCB024-Lampada Mini Nuvoletta Blu"|"0000000002"|"0000100.92"
"#34575"|"32838317"|"00000000000000358779"|"201705005303827"|"20170727"|"3"|"RB3A019642"|"MAMMA BABY OLCELLI-BALS250B-Mamma Baby Olcelli Balsamo Baby 250ml"|"0000000001"|"0000100.92"
"#34575"|"32838317"|"00000000000000358779"|"201705005303827"|"20170727"|"4"|"RB3A019646"|"MAMMA BABY OLCELLI-SHINT150B-Mamma Baby Olcelli Detergente Intimo Baby 150 ml"|"0000000001"|"0000100.92"
"#34575"|"32838317"|"00000000000000358779"|"201705005303827"|"20170727"|"5"|"RB3A019649"|"MAMMA BABY OLCELLI-DOSOLB-Mamma Baby Olcelli Crema Dopo Sole Baby"|"0000000001"|"0000100.92"
"#34575"|"32838317"|"00000000000000358779"|"201705005303827"|"20170727"|"6"|"RB3A019648"|"MAMMA BABY OLCELLI-SOL30B-Mamma Baby Olcelli Crema per il Sole Baby Protezione 30"|"0000000001"|"0000100.92"
"#34570"|"32839317"|"00000000000000358669"|"201705005303735"|"20170727"|"1"|"RB3A013684"|"BLADEeROSE-5060257466986-Top Hedgehog 3-4y"|"0000000001"|"0000073.23"
"#34570"|"32839317"|"00000000000000358669"|"201705005303735"|"20170727"|"2"|"RB3A013672"|"BLADEeROSE-5060257464197-Leggings Hedgehog 3-4y"|"0000000001"|"0000073.23"
"#34570"|"32839317"|"00000000000000358669"|"201705005303735"|"20170727"|"3"|"RB3A013575"|"BLADEeROSE-5060257465798-Leggings Crazy Cat 3-4y"|"0000000001"|"0000073.23"
"#34570"|"32839317"|"00000000000000358669"|"201705005303735"|"20170727"|"4"|"RB3A019940"|"MIAMI KIDS-S15901A-YELLOW-Sneaker Slip on Baby Giallo-26"|"0000000001"|"0000073.23"
"#34569"|"32840317"|"00000000000000358709"|"201705005303656"|"20170727"|"1"|"RB3A012503"|"BLOOMINGVILLE-47305103-Bicchierino Nelly"|"0000000001"|"0000051.71"
"#34569"|"32840317"|"00000000000000358709"|"201705005303656"|"20170727"|"2"|"RB3A012507"|"BLOOMINGVILLE-47305113-Ciotola Nelly"|"0000000001"|"0000051.71"
"#34569"|"32840317"|"00000000000000358709"|"201705005303656"|"20170727"|"3"|"RB3A012502"|"BLOOMINGVILLE-47305102-Piattino Nelly"|"0000000001"|"0000051.71"
"#34569"|"32840317"|"00000000000000358709"|"201705005303656"|"20170727"|"4"|"RB3A021080"|"WE MIGHT BE TINY-WT-BO-003-Tovaglietta in Silicone Orso Rosa"|"0000000001"|"0000051.71"
"#34567"|"32841317"|"00000000000000358379"|"201705005303489"|"20170727"|"1"|"RB3A014978"|"MINILAND-89163-ON THE GO STERILIZER"|"0000000001"|"0000032.00"
"#34563"|"32842317"|"00000000000000358349"|"201705005303565"|"20170727"|"1"|"RB3A019647"|"MAMMA BABY OLCELLI-SOL50B-Mamma Baby Olcelli Crema per il Sole Baby Protezione 50+"|"0000000001"|"0000025.86"
"#34557"|"32843317"|"00000000000000358459"|"201705005303042"|"20170727"|"1"|"RB3A008324"|"COQ EN PATE-L13EACCBOBMBLIO-Cappellino Leone - S (6-18 mesi)"|"0000000001"|"0000020.86"
"#34551"|"32844317"|"00000000000000358359"|"201705005303569"|"20170727"|"1"|"RB3A016475"|"ROCKETBABY-RBP16360-Cesto Passeggino Narvalo"|"0000000001"|"0000025.86"
"#34549"|"32845317"|"00000000000000358409"|"201705005303545"|"20170727"|"1"|"RB3A014881"|"ROCKETBABY-RBP16344-Sacco Nanna Balena Tortora"|"0000000001"|"0000054.76"
"#34548"|"32846317"|"00000000000000358329"|"201705005303559"|"20170727"|"1"|"RB3A020987"|"MINILAND-89152-Thermos per Pappe e Bevande con Contenitori Ermetici Blu"|"0000000001"|"0000027.86"
"#34546"|"32847317"|"00000000000000358389"|"201705005303514"|"20170727"|"1"|"RB3A014975"|"MINILAND-89070-WARMY TRAVEL"|"0000000001"|"0000024.80"
"#34545"|"32848317"|"00000000000000358839"|"201705005303791"|"20170727"|"1"|"RB3A008920"|"TYRRELL KATZ-Snack Boxes principesse"|"0000000001"|"0000059.00"
"#34545"|"32848317"|"00000000000000358839"|"201705005303791"|"20170727"|"2"|"RB3A011121"|"TYRRELL KATZ-13LU2-Lunch Bag Dinosauri"|"0000000001"|"0000059.00"
"#34545"|"32848317"|"00000000000000358839"|"201705005303791"|"20170727"|"3"|"RB3A020799"|"STEPHEN JOSEPH-SJ101159-Borraccia Morbida Dinosauro"|"0000000001"|"0000059.00"
"#34545"|"32848317"|"00000000000000358839"|"201705005303791"|"20170727"|"4"|"RB3A020890"|"KG DESIGN-100103-Set 2 Portagelato in Silicone Verde Turchese"|"0000000001"|"0000059.00"
"#34545"|"32848317"|"00000000000000358839"|"201705005303791"|"20170727"|"5"|"RB3A011655"|"IPANEMA-24044-Infradito Ipanema Classic Kid Fuxia 33/34"|"0000000001"|"0000059.00"
"#34544"|"32849317"|"00000000000000358659"|"201705005303723"|"20170727"|"1"|"RB3A014890"|"ROCKETBABY-RBP16332-Cesto Portagiochi Elefante"|"0000000001"|"0000067.72"
"#34544"|"32849317"|"00000000000000358659"|"201705005303723"|"20170727"|"2"|"RB3A014889"|"ROCKETBABY-RBP16331-Cesto Portagiochi Pulcino"|"0000000001"|"0000067.72"
"#34539"|"32850317"|"00000000000000358719"|"201705005303692"|"20170727"|"1"|"RB3A012456"|"VULLI-200319-Anello Dentizione morbido"|"0000000001"|"0000050.26"
"#34539"|"32850317"|"00000000000000358719"|"201705005303692"|"20170727"|"2"|"RB3A018632"|"CHEEKY CHOMPERS-CC033-DouDou con Giochino per la Dentizione Incorporato Ditsy"|"0000000001"|"0000050.26"
"#34536"|"32851317"|"00000000000000358469"|"201705005303393"|"20170727"|"1"|"RB3A020108"|"IGOR SHOES-S10107-083-Sandali da Spiaggia Tenis Azzurro-20"|"0000000001"|"0000028.85"
"#34533"|"32852317"|"00000000000000358819"|"201705005303777"|"20170727"|"1"|"RB3A011072"|"FCTRY-SKSTA02-Calzine antiscivolo Sport Bianca e Rossa"|"0000000001"|"0000036.72"
"#34533"|"32852317"|"00000000000000358819"|"201705005303777"|"20170727"|"2"|"RB3A009312"|"ROCKETBABY-RBP15100301-Cesto per Passeggino Camaleonte"|"0000000001"|"0000036.72"
"#34456"|"32853317"|"00000000000000358029"|"201705005303177"|"20170727"|"1"|"RB3A021010"|"MOUTHIE MITTEN-MM01G-EU-Guantino Massaggia Gengive per la Dentizione Verde"|"0000000001"|"0000026.86"
"#34210"|"32854317"|"00000000000000358559"|"201705005303712"|"20170727"|"1"|"RB3A019504"|"MUNCHKIN-12080-Cuscino imbottito salva ginocchia per il bagnetto Munchkin"|"0000000001"|"0000041.72"
"#34210"|"32854317"|"00000000000000358559"|"201705005303712"|"20170727"|"2"|"RB3A021007"|"CUP CATCHER-CC12NB-Cordino salva Bottiglie e Gioco per la Dentizione 2 in 1 Blu"|"0000000001"|"0000041.72"
"#34207"|"32855317"|"00000000000000358499"|"201705005303538"|"20170727"|"1"|"RB3A020999"|"FUNBITES-2001-TagliaPappa Mostriciattolo Rosa"|"0000000001"|"0000040.78"
"#34207"|"32855317"|"00000000000000358499"|"201705005303538"|"20170727"|"2"|"RB3A020996"|"FUNBITES-1001-TagliaPappa Mostriciattolo Verde"|"0000000001"|"0000040.78"
"#34207"|"32855317"|"00000000000000358499"|"201705005303538"|"20170727"|"3"|"RB3A021010"|"MOUTHIE MITTEN-MM01G-EU-Guantino Massaggia Gengive per la Dentizione Verde"|"0000000001"|"0000040.78"
"#34310"|"32856317"|"00000000000000358519"|"201705005303505"|"20170727"|"1"|"RB3A020509"|"MIAMI KIDS-DJ0670-2-Sneakers Soft Sole Righe Bianche e Navy-0-6 Mesi"|"0000000001"|"0000045.82"
"#34310"|"32856317"|"00000000000000358519"|"201705005303505"|"20170727"|"2"|"RB3A021009"|"MOUTHIE MITTEN-MM04A-EU-Guantino Massaggia Gengive per la Dentizione Aqua"|"0000000001"|"0000045.82"
"#34178"|"32857317"|"00000000000000357919"|"201705005303227"|"20170727"|"1"|"RB3A021007"|"CUP CATCHER-CC12NB-Cordino salva Bottiglie e Gioco per la Dentizione 2 in 1 Blu"|"0000000001"|"0000023.86"
"#34177"|"32858317"|"00000000000000358099"|"201705005303255"|"20170727"|"1"|"RB3A021011"|"MOUTHIE MITTEN-MM02P-EU-Guantino Massaggia Gengive per la Dentizione Viola"|"0000000001"|"0000026.86"
"#34171"|"32859317"|"00000000000000358529"|"201705005303522"|"20170727"|"1"|"RB3A020242"|"NUOTA CON FLIPPER-2000994052083-VERDE-Ciambella Collo Verde"|"0000000001"|"0000074.64"
"#34171"|"32859317"|"00000000000000358529"|"201705005303522"|"20170727"|"2"|"RB3A021009"|"MOUTHIE MITTEN-MM04A-EU-Guantino Massaggia Gengive per la Dentizione Aqua"|"0000000001"|"0000074.64"
"#34171"|"32859317"|"00000000000000358529"|"201705005303522"|"20170727"|"3"|"RB3A020716"|"ROCKETBABY-RBP16378-Set 6 Swaddle Clips Gradazione Nera per Passeggino e Culla"|"0000000001"|"0000074.64"
"#34171"|"32859317"|"00000000000000358529"|"201705005303522"|"20170727"|"4"|"RB3A020709"|"ROCKETBABY-RBP16371-Set 2 Swaddle 60 x 70 cm Volpe Blu e Gatto Nero"|"0000000001"|"0000074.64"
"#34158"|"32860317"|"00000000000000357929"|"201705005303287"|"20170727"|"1"|"RB3A021008"|"MOUTHIE MITTEN-MM05P-EU-Guantino Massaggia Gengive per la Dentizione Rosa"|"0000000001"|"0000026.86"
"#34155"|"32861317"|"00000000000000357879"|"201705005303128"|"20170727"|"1"|"RB3A021106"|"GYMNIC-80_02-Gonfiabile Cavallino Rosso"|"0000000001"|"0000042.76"
"#34124"|"32862317"|"00000000000000357889"|"201705005303130"|"20170727"|"1"|"RB3A021106"|"GYMNIC-80_02-Gonfiabile Cavallino Rosso"|"0000000001"|"0000039.27"
"#34122"|"32863317"|"00000000000000357939"|"201705005303276"|"20170727"|"1"|"RB3A021011"|"MOUTHIE MITTEN-MM02P-EU-Guantino Massaggia Gengive per la Dentizione Viola"|"0000000001"|"0000046.82"
"#34122"|"32863317"|"00000000000000357939"|"201705005303276"|"20170727"|"2"|"RB3A021008"|"MOUTHIE MITTEN-MM05P-EU-Guantino Massaggia Gengive per la Dentizione Rosa"|"0000000001"|"0000046.82"
"#34118"|"32864317"|"00000000000000357859"|"201705005303108"|"20170727"|"1"|"RB3A021100"|"GYMNIC-95_06-Fit-Ball per Allenamento Bianca"|"0000000005"|"0000115.70"
"#34113"|"32865317"|"00000000000000358039"|"201705005303175"|"20170727"|"1"|"RB3A021010"|"MOUTHIE MITTEN-MM01G-EU-Guantino Massaggia Gengive per la Dentizione Verde"|"0000000001"|"0000026.86"
"#34106"|"32866317"|"00000000000000357869"|"201705005303119"|"20170727"|"1"|"RB3A021104"|"GYMNIC-80_06-Gonfiabile Giraffa"|"0000000001"|"0000042.76"
"#34087"|"32867317"|"00000000000000357949"|"201705005303283"|"20170727"|"1"|"RB3A021008"|"MOUTHIE MITTEN-MM05P-EU-Guantino Massaggia Gengive per la Dentizione Rosa"|"0000000001"|"0000026.86"
"#34073"|"32868317"|"00000000000000358109"|"201705005303254"|"20170727"|"1"|"RB3A021011"|"MOUTHIE MITTEN-MM02P-EU-Guantino Massaggia Gengive per la Dentizione Viola"|"0000000001"|"0000026.86"
"#34050"|"32869317"|"00000000000000357849"|"201705005303076"|"20170727"|"1"|"RB3A021101"|"GYMNIC-99_04-Pompetta per il Gonfiaggio Manuale"|"0000000001"|"0000058.72"
"#34050"|"32869317"|"00000000000000357849"|"201705005303076"|"20170727"|"2"|"RB3A021097"|"GYMNIC-88_06-Gonfiabile Sens'o'Roll Arancione"|"0000000001"|"0000058.72"
"#34048"|"32870317"|"00000000000000358479"|"201705005303394"|"20170727"|"1"|"RB3A021094"|"FREDS SWIM ACADEMY-10110-Ciambella Salvagente Rossa"|"0000000001"|"0000035.82"
"#34048"|"32870317"|"00000000000000358479"|"201705005303394"|"20170727"|"2"|"RB3A021101"|"GYMNIC-99_04-Pompetta per il Gonfiaggio Manuale"|"0000000001"|"0000035.82"
"#34040"|"32871317"|"00000000000000358119"|"201705005303253"|"20170727"|"1"|"RB3A021011"|"MOUTHIE MITTEN-MM02P-EU-Guantino Massaggia Gengive per la Dentizione Viola"|"0000000001"|"0000026.86"
"#34038"|"32872317"|"00000000000000357989"|"201705005303234"|"20170727"|"1"|"RB3A021009"|"MOUTHIE MITTEN-MM04A-EU-Guantino Massaggia Gengive per la Dentizione Aqua"|"0000000001"|"0000026.86"
"#34028"|"32873317"|"00000000000000358209"|"201705005303320"|"20170727"|"1"|"RB3A020004"|"IGOR SHOES-S10108-017-Sandali da Spiaggia Cholo Grigio-25"|"0000000001"|"0000021.85"
"#33966"|"32874317"|"00000000000000357959"|"201705005303284"|"20170727"|"1"|"RB3A021008"|"MOUTHIE MITTEN-MM05P-EU-Guantino Massaggia Gengive per la Dentizione Rosa"|"0000000001"|"0000026.86"
"#33952"|"32875317"|"00000000000000358229"|"201705005303389"|"20170727"|"1"|"RB3A020018"|"IGOR SHOES-S10108-090-Sandali da Spiaggia Cholo Rosa-21"|"0000000001"|"0000021.85"
"#33935"|"32876317"|"00000000000000358129"|"201705005303252"|"20170727"|"1"|"RB3A021011"|"MOUTHIE MITTEN-MM02P-EU-Guantino Massaggia Gengive per la Dentizione Viola"|"0000000002"|"0000046.82"
"#33933"|"32877317"|"00000000000000358569"|"201705005303757"|"20170727"|"1"|"RB3A018624"|"CHEEKY CHOMPERS-CC009-Bavaglino a Bandana con Gioco per la Dentizione Incorporato Twinkle Twinkle"|"0000000001"|"0000086.64"
"#33933"|"32877317"|"00000000000000358569"|"201705005303757"|"20170727"|"2"|"RB3A021009"|"MOUTHIE MITTEN-MM04A-EU-Guantino Massaggia Gengive per la Dentizione Aqua"|"0000000001"|"0000086.64"
"#33933"|"32877317"|"00000000000000358569"|"201705005303757"|"20170727"|"3"|"RB3A021094"|"FREDS SWIM ACADEMY-10110-Ciambella Salvagente Rossa"|"0000000001"|"0000086.64"
"#33933"|"32877317"|"00000000000000358569"|"201705005303757"|"20170727"|"4"|"RB3A020241"|"NUOTA CON FLIPPER-2000994052083-GIALLO-Ciambella Collo Gialla"|"0000000001"|"0000086.64"
"#33911"|"32878317"|"00000000000000358049"|"201705005303174"|"20170727"|"1"|"RB3A021010"|"MOUTHIE MITTEN-MM01G-EU-Guantino Massaggia Gengive per la Dentizione Verde"|"0000000001"|"0000026.86"
"#33790"|"32879317"|"00000000000000358149"|"201705005303347"|"20170727"|"1"|"RB3A020274"|"IGOR SHOES-S10110-032-Sandali Bondi Blu-19"|"0000000001"|"0000028.86"
"#33788"|"32880317"|"00000000000000358239"|"201705005303380"|"20170727"|"1"|"RB3A020023"|"IGOR SHOES-S10108-090-Sandali da Spiaggia Cholo Rosa-26"|"0000000001"|"0000021.85"
"#33767"|"32881317"|"00000000000000358179"|"201705005303334"|"20170727"|"1"|"RB3A019981"|"IGOR SHOES-S10108-003-Sandali da Spiaggia Cholo Blu Navy-20"|"0000000001"|"0000044.70"
"#33767"|"32881317"|"00000000000000358179"|"201705005303334"|"20170727"|"2"|"RB3A020107"|"IGOR SHOES-S10107-083-Sandali da Spiaggia Tenis Azzurro-19"|"0000000001"|"0000044.70"
"#33719"|"32882317"|"00000000000000358189"|"201705005303312"|"20170727"|"1"|"RB3A019983"|"IGOR SHOES-S10108-003-Sandali da Spiaggia Cholo Blu Navy-22"|"0000000002"|"0000037.70"
"#34535"|"32883317"|"00000000000000358399"|"201705005303540"|"20170727"|"1"|"RB3A014884"|"ROCKETBABY-RBP16347-Sacco Nanna Balena Verde Menta"|"0000000001"|"0000000.00"
"#33927A"|"32884317"|"00000000000000358649"|"201705005303705"|"20170727"|"1"|"RB3A020242"|"NUOTA CON FLIPPER-2000994052083-VERDE-Ciambella Collo Verde"|"0000000001"|"0000000.00"
"#33927A"|"32884317"|"00000000000000358649"|"201705005303705"|"20170727"|"2"|"RB3A020856"|"LA MILLOU PARENTS PRIDE-HAT-G-AMOR-Cappellino da Sole Regolabile Owl Radio"|"0000000001"|"0000000.00"
"#33927A"|"32884317"|"00000000000000358649"|"201705005303705"|"20170727"|"3"|"RB3A015626"|"JET KIDS- BEDBOX RED-Lettino da viaggio treno e aereo rosso"|"0000000001"|"0000000.00"
"#31904A"|"32885317"|"00000000000000358319"|"201705005303563"|"20170727"|"1"|"RB3A020824"|"CHARLIE BANANA-8870114-Costumino Pannolino Coni Gelato-M"|"0000000001"|"0000000.00"
"#34572"|"32886317"|"00000000000000358299"|"201705005303392"|"20170727"|"1"|"RB3A011636"|"BIG MOUTH-BMBTDO-Telo da mare XXL Ciambella alla Fragola"|"0000000001"|"0000000.00"
"#34565"|"32887317"|"00000000000000358749"|"201705005303621"|"20170727"|"1"|"RB3A012385"|"THE MAGIC DOOR STORE-0700461482482-My Yellow Elf Door"|"0000000001"|"0000000.00"
"#34565"|"32887317"|"00000000000000358749"|"201705005303621"|"20170727"|"2"|"RB3A012378"|"THE MAGIC DOOR STORE-0700461482437-My Elf Door Green"|"0000000001"|"0000000.00"
"#34556"|"32888317"|"00000000000000358059"|"201705005303173"|"20170727"|"1"|"RB3A021010"|"MOUTHIE MITTEN-MM01G-EU-Guantino Massaggia Gengive per la Dentizione Verde"|"0000000001"|"0000000.00"
"#34555"|"32889317"|"00000000000000358429"|"201705005303701"|"20170727"|"1"|"RB3A013436"|"ELODIE DETAILS-103616-Borsa Fasciatoio Forest Flora"|"0000000001"|"0000000.00"
"#34552"|"32890317"|"00000000000000358759"|"201705005303643"|"20170727"|"1"|"RB3A012376"|"ROCKETBABY-RBP16309-Cesto Portagiochi Sweetie il Gelato"|"0000000001"|"0000000.00"
"#34552"|"32890317"|"00000000000000358759"|"201705005303643"|"20170727"|"2"|"RB3A014891"|"ROCKETBABY-RBP16333-Scatola Portagiochi Flamingo"|"0000000001"|"0000000.00"
"#34541"|"32891317"|"00000000000000358809"|"201705005303780"|"20170727"|"1"|"RB3A010297"|"KUK-F115-37-Set 2 Copertine 70x60 Elefanti Rosa"|"0000000001"|"0000000.00"
"#34541"|"32891317"|"00000000000000358809"|"201705005303780"|"20170727"|"2"|"RB3A009313"|"ROCKETBABY-RBP15100302-Cesto per Passeggino Elefante Verde"|"0000000001"|"0000000.00"
"#34444"|"32892317"|"00000000000000358859"|"201705005303795"|"20170727"|"1"|"RB20005W"|"ELODIE DETAILS-103400-Bavaglino Prince Jolly"|"0000000001"|"0000000.00"
"#34444"|"32892317"|"00000000000000358859"|"201705005303795"|"20170727"|"2"|"RB3A019773"|"SUAVINEX-QS005DR03-DUCCIO STERILIZZACIUCCIO ROSSO"|"0000000001"|"0000000.00"
"#34246"|"32893317"|"00000000000000358689"|"201705005303684"|"20170727"|"1"|"RB3A021108"|"GYMNIC-80_09-Gonfiabile Coniglietto Rosa"|"0000000001"|"0000000.00"
"#34246"|"32893317"|"00000000000000358689"|"201705005303684"|"20170727"|"2"|"RB3A012947"|"HAPPY HOPPERZ-HHZ03-Gonfiabile Cavalcabile Small Cane Blu"|"0000000001"|"0000000.00"
"#32350A"|"32894317"|"00000000000000358269"|"201705005303160"|"20170727"|"1"|"RB3A017523"|"LILIPUTI-2006003010143-Marsupio Mei Tai Skully"|"0000000001"|"0000000.00"
"#34174"|"32895317"|"00000000000000357969"|"201705005303285"|"20170727"|"1"|"RB3A021008"|"MOUTHIE MITTEN-MM05P-EU-Guantino Massaggia Gengive per la Dentizione Rosa"|"0000000001"|"0000000.00"
"#34126"|"32896317"|"00000000000000359019"|"201705005303858"|"20170727"|"1"|"RB3A021011"|"MOUTHIE MITTEN-MM02P-EU-Guantino Massaggia Gengive per la Dentizione Viola"|"0000000001"|"0000000.00"
"#34126"|"32896317"|"00000000000000359019"|"201705005303858"|"20170727"|"2"|"RB3A014883"|"ROCKETBABY-RBP16346-Sacco Nanna Balena Blu Oceano"|"0000000001"|"0000000.00"
"#34104"|"32897317"|"00000000000000358679"|"201705005303724"|"20170727"|"1"|"RB3A012952"|"HAPPY HOPPERZ-HHZ11-Gonfiabile Cavalcabile Medium Dino Verde"|"0000000001"|"0000000.00"
"#34104"|"32897317"|"00000000000000358679"|"201705005303724"|"20170727"|"2"|"RB3A021104"|"GYMNIC-80_06-Gonfiabile Giraffa"|"0000000001"|"0000000.00"
"#34053"|"32898317"|"00000000000000358309"|"201705005303590"|"20170727"|"1"|"RB3A020299"|"IGOR SHOES-S10110-046-Sandali Bondi Fucsia-27"|"0000000001"|"0000000.00"
"#34053"|"32898317"|"00000000000000358309"|"201705005303590"|"20170727"|"2"|"RB3A020363"|"IGOR SHOES-S10146-046-Sandali Bondi Bicolor Fucsia e Acquamarina-23"|"0000000001"|"0000000.00"
"#34053"|"32898317"|"00000000000000358309"|"201705005303590"|"20170727"|"3"|"RB3A011637"|"BIG MOUTH-BMBTPI-Telo da mare XXL Pizza"|"0000000002"|"0000000.00"
"#34053"|"32898317"|"00000000000000358309"|"201705005303590"|"20170727"|"4"|"RB3A011631"|"BIG MOUTH-BMPFPS-Materassino gonfiabile XXL Pizza"|"0000000001"|"0000000.00"
"#34036"|"32899317"|"00000000000000357999"|"201705005303235"|"20170727"|"1"|"RB3A021009"|"MOUTHIE MITTEN-MM04A-EU-Guantino Massaggia Gengive per la Dentizione Aqua"|"0000000001"|"0000000.00"
"#34023"|"32900317"|"00000000000000358249"|"201705005303207"|"20170727"|"1"|"RB3A019708"|"SUAVINEX-QS005DT01-DUCCIO STERILIZZACIUCCIO BLU"|"0000000001"|"0000000.00"
"#33994"|"32901317"|"00000000000000358549"|"201705005303062"|"20170727"|"1"|"RB3A019721"|"SUAVINEX-QS0240002-ECOBIO BABY DETERSIVO STOVIGLIE"|"0000000001"|"0000000.00"
"#33994"|"32901317"|"00000000000000358549"|"201705005303062"|"20170727"|"2"|"RB3A021011"|"MOUTHIE MITTEN-MM02P-EU-Guantino Massaggia Gengive per la Dentizione Viola"|"0000000001"|"0000000.00"
"#33994"|"32901317"|"00000000000000358549"|"201705005303062"|"20170727"|"3"|"RB3A020869"|"LA MILLOU PARENTS PRIDE-AW-POB-DR-Supporto Ergonomico per la Testa Orsi Polari"|"0000000001"|"0000000.00"
"#33944"|"32902317"|"00000000000000358069"|"201705005303172"|"20170727"|"1"|"RB3A021010"|"MOUTHIE MITTEN-MM01G-EU-Guantino Massaggia Gengive per la Dentizione Verde"|"0000000001"|"0000000.00"
"#33822"|"32903317"|"00000000000000358219"|"201705005303391"|"20170727"|"1"|"RB3A020018"|"IGOR SHOES-S10108-090-Sandali da Spiaggia Cholo Rosa-21"|"0000000002"|"0000000.00"
"#33813"|"32904317"|"00000000000000358279"|"201705005303052"|"20170727"|"1"|"RB3A017533"|"LILIPUTI-2006004020110-Stretchy Wrap Skully"|"0000000001"|"0000000.00"
"#33793"|"32905317"|"00000000000000358849"|"201705005303843"|"20170727"|"1"|"RB3A020742"|"DRINK IN THE BOX-1912ICE-Panetto di Ghiaccio per Borraccia 355 ml"|"0000000001"|"0000000.00"
"#33793"|"32905317"|"00000000000000358849"|"201705005303843"|"20170727"|"10"|"RB3A008313"|"COQ EN PATE-L15ACCBOBMBSNOCappellino Leopardo Bianco M (2-3 anni)"|"0000000001"|"0000000.00"
"#33793"|"32905317"|"00000000000000358849"|"201705005303843"|"20170727"|"11"|"RB3A020704"|"ROCKETBABY-RBP16366-Set 2 Swaddle 120 x 120 cm Volpe Blu e Gatto Nero"|"0000000001"|"0000000.00"
"#33793"|"32905317"|"00000000000000358849"|"201705005303843"|"20170727"|"12"|"RB3A020709"|"ROCKETBABY-RBP16371-Set 2 Swaddle 60 x 70 cm Volpe Blu e Gatto Nero"|"0000000001"|"0000000.00"
"#33793"|"32905317"|"00000000000000358849"|"201705005303843"|"20170727"|"13"|"RB3A021094"|"FREDS SWIM ACADEMY-10110-Ciambella Salvagente Rossa"|"0000000001"|"0000000.00"
"#33793"|"32905317"|"00000000000000358849"|"201705005303843"|"20170727"|"2"|"RB3A020722"|"DRINK IN THE BOX-1912GRPM-Borraccia con Cannuccia Integrata 355 ml Verde"|"0000000001"|"0000000.00"
"#33793"|"32905317"|"00000000000000358849"|"201705005303843"|"20170727"|"3"|"RB3A020726"|"DRINK IN THE BOX-1901GRPM-Snack Box 355 ml Verde"|"0000000001"|"0000000.00"
"#33793"|"32905317"|"00000000000000358849"|"201705005303843"|"20170727"|"4"|"RB3A019664"|"FUNKIT WORLD-FBE-73-Funkit World Frisbee in Silicone Verde Lime"|"0000000001"|"0000000.00"
"#33793"|"32905317"|"00000000000000358849"|"201705005303843"|"20170727"|"5"|"RB3A019654"|"FUNKIT WORLD-SMO-41-Funkit World Formine per la Sabbia in Silicone Blu"|"0000000001"|"0000000.00"
"#33793"|"32905317"|"00000000000000358849"|"201705005303843"|"20170727"|"6"|"RB3A019650"|"FUNKIT WORLD-SBU-01-Funkit World Secchiello da Spiaggia in Silicone Blu"|"0000000001"|"0000000.00"
"#33793"|"32905317"|"00000000000000358849"|"201705005303843"|"20170727"|"7"|"RB3A019655"|"FUNKIT WORLD-SSP-51-Funkit World Paletta per la Sabbia in Silicone Blu"|"0000000001"|"0000000.00"
"#33793"|"32905317"|"00000000000000358849"|"201705005303843"|"20170727"|"8"|"RB3A020142"|"IGOR SHOES-S10107-094-Sandali da Spiaggia Tenis Verde Pistacchio-22"|"0000000001"|"0000000.00"
"#33793"|"32905317"|"00000000000000358849"|"201705005303843"|"20170727"|"9"|"RB3A020968"|"KISKISE-KK_SNS604-Seggiolone da Borsetta Blu/Turchese"|"0000000001"|"0000000.00"
"#33792"|"32906317"|"00000000000000358169"|"201705005303354"|"20170727"|"1"|"RB3A019979"|"IGOR SHOES-S10108-003-Sandali da Spiaggia Cholo Blu Navy-18"|"0000000001"|"0000000.00"
"#33753"|"32907317"|"00000000000000358579"|"201705005303751"|"20170727"|"1"|"RB3A018662"|"LOLLIPOPS AND MORE-2952349927136-Lollipops and More Pacifier Tootsie Roll Clip Navy"|"0000000001"|"0000000.00"
"#33753"|"32907317"|"00000000000000358579"|"201705005303751"|"20170727"|"2"|"RB3A020110"|"IGOR SHOES-S10107-083-Sandali da Spiaggia Tenis Azzurro-22"|"0000000001"|"0000000.00"
"#33590"|"32908317"|"00000000000000358539"|"201705005303890"|"20170727"|"1"|"RB3A019708"|"SUAVINEX-QS005DT01-DUCCIO STERILIZZACIUCCIO BLU"|"0000000001"|"0000000.00"
"#33590"|"32908317"|"00000000000000358539"|"201705005303890"|"20170727"|"2"|"RB3A019849"|"SKIP HOP-235465-Moby Smart Vasca da Bagno - COLORE UNICO"|"0000000001"|"0000000.00"
"#34577"|"32909317"|"00000000000000358339"|"201705005303557"|"20170727"|"1"|"RB3A020987"|"MINILAND-89152-Thermos per Pappe e Bevande con Contenitori Ermetici Blu"|"0000000001"|"0000000.00"
"#34559"|"32910317"|"00000000000000358449"|"201705005303605"|"20170727"|"1"|"RB3A009817"|"FCTRY-GLSTA21-Occhiali da Sole Baby Neri 0-2 anni"|"0000000001"|"0000000.00"
"#34558"|"32911317"|"00000000000000358369"|"201705005303766"|"20170727"|"1"|"RB3A015627"|"JET KIDS- BEDBOX BLUE-Lettino da viaggio treno e aereo blu"|"0000000001"|"0000000.00"
"#34503"|"32912317"|"00000000000000358289"|"201705005303396"|"20170727"|"1"|"RB3A021004"|"CUP CATCHER-CC01AQ-Cordino salva Bottiglie e Gioco per la Dentizione 2 in 1 Acqua"|"0000000001"|"0000000.00"
"#34503"|"32912317"|"00000000000000358289"|"201705005303396"|"20170727"|"2"|"RB3A021005"|"CUP CATCHER-CC08CL-Cordino salva Bottiglie e Gioco per la Dentizione 2 in 1 Corallo"|"0000000001"|"0000000.00"
"#34503"|"32912317"|"00000000000000358289"|"201705005303396"|"20170727"|"3"|"RB3A020714"|"ROCKETBABY-RBP16376-Set 6 Swaddle Clips Gradazione Rosa per Passeggino e Culla"|"0000000001"|"0000000.00"
